[
  {
    "id": "21-cards",
    "titolo": "Le 21 Carte",
    "categoria": "trucco",
    "livello": 1,
    "tags": [
      "automatico",
      "matematico"
    ],
    "youtube_id": "w3ncGQEEUsA",
    "canale": "Mismag822",
    "descrizione": "Il classico trucco matematico: trovare la carta scelta dopo tre distribuzioni.",
    "prerequisiti": [
      "dealing-position"
    ]
  },
  {
    "id": "key-card",
    "titolo": "Key Card",
    "categoria": "trucco",
    "livello": 1,
    "tags": [
      "principio",
      "facile"
    ],
    "youtube_id": "jZ1hvOXr3pI",
    "canale": "Mismag822",
    "descrizione": "Trovare una carta usando una carta chiave nascosta. Principio fondamentale.",
    "prerequisiti": [
      "pinky-break"
    ]
  },
  {
    "id": "do-as-i-do",
    "titolo": "Gemelli d'Oro / Do as I Do",
    "categoria": "trucco",
    "livello": 1,
    "tags": [
      "sincronia",
      "coppie"
    ],
    "youtube_id": "AAEkRvSYtIY",
    "canale": "Chris Ramsay",
    "descrizione": "Due mazzi, stessi movimenti: alla fine le carte scelte coincidono.",
    "prerequisiti": [
      "overhand-shuffle"
    ]
  },
  {
    "id": "ambitious-card",
    "titolo": "Carta Ambiziosa (Ambitious Card)",
    "categoria": "trucco",
    "livello": 2,
    "tags": [
      "routine",
      "classico"
    ],
    "youtube_id": "Zgl5eqTiiE4",
    "canale": "52Kards",
    "descrizione": "La carta firmata torna sempre in cima, non importa quanto la seppellisci.",
    "prerequisiti": [
      "double-lift",
      "double-undercut",
      "hindu-shuffle"
    ]
  },
  {
    "id": "chicago-surprise",
    "titolo": "Chicago Surprise / Red Hot Mama",
    "categoria": "trucco",
    "livello": 2,
    "tags": [
      "colore",
      "sorpresa"
    ],
    "youtube_id": "xMwmEDzBqeY",
    "canale": "Mismag822",
    "descrizione": "Una carta cambia colore nel mazzo. Variante moderna del Chicago Opener.",
    "prerequisiti": [
      "double-lift",
      "glide"
    ]
  },
  {
    "id": "triumph",
    "titolo": "Triumph (Slop Shuffle)",
    "categoria": "trucco",
    "livello": 2,
    "tags": [
      "routine",
      "vernon"
    ],
    "youtube_id": "PQpQwLBDQKw",
    "canale": "52Kards",
    "descrizione": "Mazzo mescolato faccia su e giù si riordina, tranne la carta scelta.",
    "prerequisiti": [
      "overhand-shuffle",
      "pinky-break",
      "double-undercut"
    ]
  },
  {
    "id": "two-card-monte",
    "titolo": "Two Card Monte",
    "categoria": "trucco",
    "livello": 2,
    "tags": [
      "street",
      "veloce"
    ],
    "youtube_id": "Mm0EcpCkCi8",
    "canale": "Mismag822",
    "descrizione": "Trucco da strada con due carte: lo spettatore non trova mai quella giusta.",
    "prerequisiti": [
      "glide",
      "double-lift"
    ]
  },
  {
    "id": "out-of-this-world",
    "titolo": "Out of This World",
    "categoria": "trucco",
    "livello": 3,
    "tags": [
      "miracolo",
      "paul curry"
    ],
    "youtube_id": "e_RJIHk4K8c",
    "canale": "Mismag822",
    "descrizione": "Lo spettatore separa rossi e neri senza guardare le facce. Effetto impossibile.",
    "prerequisiti": [
      "overhand-shuffle",
      "pinky-break"
    ]
  },
  {
    "id": "reset",
    "titolo": "Reset",
    "categoria": "trucco",
    "livello": 3,
    "tags": [
      "trasformazione",
      "assi"
    ],
    "youtube_id": "1CUJaUvgK84",
    "canale": "Kimoon",
    "descrizione": "Quattro assi diventano quattro re e tornano assi. Routine di Paul Harris.",
    "prerequisiti": [
      "double-lift",
      "elmsley-count"
    ]
  },
  {
    "id": "acaan",
    "titolo": "ACAAN",
    "categoria": "trucco",
    "livello": 3,
    "tags": [
      "mentalismo",
      "impossibile"
    ],
    "youtube_id": "VOTqjzuoWZ4",
    "canale": "Mismag822",
    "descrizione": "Any Card At Any Number: carta e numero liberi, carta trovata esatta.",
    "prerequisiti": [
      "riffle-force",
      "double-undercut",
      "pinky-break"
    ]
  },
  {
    "id": "card-to-wallet",
    "titolo": "Carta nel Portafoglio",
    "categoria": "trucco",
    "livello": 3,
    "tags": [
      "vanish",
      "wallet"
    ],
    "youtube_id": "-LEXt7Wj5sA",
    "canale": "The Card Trick Teacher",
    "descrizione": "Carta firmata sparisce e riappare nel portafoglio sigillato del mago.",
    "prerequisiti": [
      "classic-palm",
      "double-lift"
    ]
  },
  {
    "id": "invisible-deck-routine",
    "titolo": "Routine Invisible Deck",
    "categoria": "trucco",
    "livello": 1,
    "tags": [
      "routine",
      "gimmick"
    ],
    "descrizione": "Una routine pazzesca dove una carta pensata risulta l'unica capovolta in un mazzo tenuto fermo.",
    "prerequisiti": [
      "invisible-deck-basics"
    ],
    "youtube_id": "sL87cp_mVYk",
    "canale": "A Million Card Tricks"
  },
  {
    "id": "svengali-routine",
    "titolo": "Routine Svengali Completa",
    "categoria": "trucco",
    "livello": 1,
    "tags": [
      "routine",
      "gimmick"
    ],
    "descrizione": "Come strabiliare col mazzo Svengali dalla forzatura al cambio totale del mazzo.",
    "prerequisiti": [
      "svengali-basics"
    ],
    "youtube_id": "b8rkmLYfVCw",
    "canale": "AboutMagic"
  },
  {
    "id": "stripper-find-four",
    "titolo": "Trova i 4 Assi (Stripper)",
    "categoria": "trucco",
    "livello": 1,
    "tags": [
      "routine",
      "gimmick"
    ],
    "descrizione": "Ritrovare istantaneamente i quattro assi mescolati nel mazzo.",
    "prerequisiti": [
      "stripper-deck-basics"
    ],
    "youtube_id": "ykDgEEk39h0",
    "canale": "The Magic Channel"
  },
  {
    "id": "biddle-trick",
    "titolo": "The Biddle Trick",
    "categoria": "trucco",
    "livello": 2,
    "tags": [
      "classico",
      "vanish"
    ],
    "descrizione": "5 carte, lo spettatore ne pensa una. Sparisce dalle 5 e si ritrova nel mazzo.",
    "prerequisiti": [
      "biddle-steal"
    ],
    "youtube_id": "wNo5dXwW5hM",
    "canale": "Disturb Reality"
  },
  {
    "id": "design-for-laughter",
    "titolo": "Design for Laughter",
    "categoria": "trucco",
    "livello": 1,
    "tags": [
      "royal-road",
      "classico"
    ],
    "descrizione": "Dalla Royal Road to Card Magic: si scambia la carta con un Glide lasciando lo spettatore confuso.",
    "prerequisiti": [
      "glide"
    ],
    "youtube_id": "T7_aSo3uPRc",
    "canale": "52Kards"
  },
  {
    "id": "designated-hitter",
    "titolo": "Designated Hitter",
    "categoria": "trucco",
    "livello": 2,
    "tags": [
      "impromptu",
      "sorpresa"
    ],
    "descrizione": "Una bellissima routine dove una carta predetta aiuta a trovare la selezione.",
    "prerequisiti": [
      "double-lift"
    ],
    "youtube_id": "Vv2WDv2AJeU",
    "canale": "Building Better Baseball"
  },
  {
    "id": "french-kiss",
    "titolo": "French Kiss",
    "categoria": "trucco",
    "livello": 3,
    "tags": [
      "street",
      "sorpresa"
    ],
    "descrizione": "Le carte piegate e firmate finiscono per scambiarsi direttamente nella bocca dello spettatore (Wayne Houchin).",
    "prerequisiti": [
      "mercury-fold"
    ],
    "youtube_id": "K9lO9IWWhq4",
    "canale": "theory11"
  },
  {
    "id": "here-then-there",
    "titolo": "Here Then There",
    "categoria": "trucco",
    "livello": 2,
    "tags": [
      "street",
      "scambio"
    ],
    "descrizione": "La carta in mano del mago si scambia incredibilmente con quella nella mano dello spettatore.",
    "prerequisiti": [
      "double-lift"
    ],
    "youtube_id": "n1TGCg8VPyo",
    "canale": "Disturb Reality"
  },
  {
    "id": "b-wave",
    "titolo": "B-Wave (Basi)",
    "categoria": "trucco",
    "livello": 2,
    "tags": [
      "packet",
      "mentalismo"
    ],
    "descrizione": "Il celebre effetto packet di Max Maven: una regina scelta liberamente è l'unica faccia in su e l'unica con dorso diverso.",
    "prerequisiti": [
      "elmsley-count"
    ],
    "youtube_id": "uaZ14GNJMpE",
    "canale": "Marketing Magic"
  },
  {
    "id": "twisting-the-aces",
    "titolo": "Twisting the Aces",
    "categoria": "trucco",
    "livello": 3,
    "tags": [
      "packet",
      "classico"
    ],
    "descrizione": "I 4 assi girano a faccia in su uno ad uno con una semplice torsione, capolavoro di Vernon.",
    "prerequisiti": [
      "elmsley-count"
    ],
    "youtube_id": "nNiR7de7Nsw",
    "canale": "Steven Taputoro"
  },
  {
    "id": "cannibal-cards",
    "titolo": "Cannibal Cards",
    "categoria": "trucco",
    "livello": 3,
    "tags": [
      "packet",
      "storytelling"
    ],
    "descrizione": "Quattro re \"cannibali\" mangiano uno alla volta le altre carte.",
    "prerequisiti": [
      "atfus"
    ],
    "youtube_id": "E4J_dvKfFhQ",
    "canale": "Murphy's Magic"
  },
  {
    "id": "oil-and-water",
    "titolo": "Oil and Water (Acqua e Olio)",
    "categoria": "trucco",
    "livello": 3,
    "tags": [
      "packet",
      "classico"
    ],
    "descrizione": "Carte rosse e nere mescolate si separano sempre da sole.",
    "prerequisiti": [
      "elmsley-count"
    ],
    "youtube_id": "WrjWrywznms",
    "canale": "Jeremy Tan"
  },
  {
    "id": "dr-daleys-last-trick",
    "titolo": "Dr. Daley's Last Trick",
    "categoria": "trucco",
    "livello": 2,
    "tags": [
      "packet",
      "classico"
    ],
    "descrizione": "Due assi rossi e due neri si scambiano di posto nelle mani degli spettatori, impatto enorme.",
    "prerequisiti": [
      "double-lift"
    ],
    "youtube_id": "PWMN67Slsvk",
    "canale": "Jason Maher"
  },
  {
    "id": "macdonalds-aces",
    "titolo": "MacDonald's Aces",
    "categoria": "trucco",
    "livello": 3,
    "tags": [
      "gimmick",
      "assi"
    ],
    "descrizione": "La scomparsa più pulita e visiva degli assi da 3 mazzetti per riunirsi nel mazzetto master.",
    "prerequisiti": [
      "double-lift"
    ],
    "youtube_id": "Cw_T9rNuMc4",
    "canale": "Best Magic"
  },
  {
    "id": "haunted-deck",